{
  "source_kind": "mit_ocw_official_caption_index",
  "dataset_id": "mit_ocw_two_course_official_captions_v1",
  "version": "1.0",
  "validated_at_utc": "2026-07-22T00:00:00Z",
  "publisher": "MIT OpenCourseWare",
  "publisher_url": "https://ocw.mit.edu/",
  "license_url": "https://creativecommons.org/licenses/by-nc-sa/4.0/",
  "publisher_terms_url": "https://ocw.mit.edu/pages/privacy-and-terms-of-use/",
  "license_note": "The official captions remain MIT OpenCourseWare material under CC BY-NC-SA 4.0 and are not relicensed by this project. This index contains URLs, hashes, and timing facts only; it contains no caption text or media.",
  "coverage_note": "Reference coverage is the time span from the first to the last official caption cue divided by the duration of the media linked on the same official lecture page. It is not frame-level speech coverage or an ASR WER measurement.",
  "courses": [
    {
      "course_id": "mit_1806",
      "name": "MIT 18.06 Linear Algebra",
      "instructor": "Gilbert Strang",
      "course_url": "https://ocw.mit.edu/courses/18-06-linear-algebra-spring-2010/",
      "recording_note": "The course page is Spring 2010; these lecture pages state that the recordings were made in Fall 1999."
    },
    {
      "course_id": "mit_60001",
      "name": "MIT 6.0001 Introduction to Computer Science and Programming in Python",
      "instructor": "Ana Bell",
      "course_url": "https://ocw.mit.edu/courses/6-0001-introduction-to-computer-science-and-programming-in-python-fall-2016/"
    }
  ],
  "videos": [
    {
      "video_id": "linear_algebra_l01",
      "course_id": "mit_1806",
      "title": "Lecture 1: The Geometry of Linear Equations",
      "source_url": "https://ocw.mit.edu/courses/18-06-linear-algebra-spring-2010/resources/lecture-1-the-geometry-of-linear-equations/",
      "caption_url": "https://ocw.mit.edu/courses/18-06-linear-algebra-spring-2010/d292ec07b3ed5124ae1409dc520e61fe_J7DzL2_Na80.vtt",
      "media_url": "http://www.archive.org/download/MIT18.06S05_MP4/01.mp4",
      "caption_sha256": "9fa6200af463b9e099735faf930e08ff55d4f9e13e09e107be19fe870d6e3d93",
      "reference_media_duration_seconds": 2388.842,
      "reference_last_caption_cue_end_seconds": 2369.81,
      "language": "en"
    },
    {
      "video_id": "linear_algebra_l02",
      "course_id": "mit_1806",
      "title": "Lecture 2: Elimination with Matrices",
      "source_url": "https://ocw.mit.edu/courses/18-06-linear-algebra-spring-2010/resources/lecture-2-elimination-with-matrices/",
      "caption_url": "https://ocw.mit.edu/courses/18-06-linear-algebra-spring-2010/916308875ad0523dafbd5b656b8d4887_QVKj3LADCnA.vtt",
      "media_url": "http://www.archive.org/download/MIT18.06S05_MP4/02.mp4",
      "caption_sha256": "24691acb19c79d716f8801ee15f67acb46bee004171fea3b43ea03f8ae32bd48",
      "reference_media_duration_seconds": 2861.371791,
      "reference_last_caption_cue_end_seconds": 2843.05,
      "language": "en"
    },
    {
      "video_id": "linear_algebra_l03",
      "course_id": "mit_1806",
      "title": "Lecture 3: Multiplication and Inverse Matrices",
      "source_url": "https://ocw.mit.edu/courses/18-06-linear-algebra-spring-2010/resources/lecture-3-multiplication-and-inverse-matrices/",
      "caption_url": "https://ocw.mit.edu/courses/18-06-linear-algebra-spring-2010/7460c549d93a598f9daaba421a2ed583_FX4C-JpTFgY.vtt",
      "media_url": "http://www.archive.org/download/MIT18.06S05_MP4/03.mp4",
      "caption_sha256": "4ba30e88b21da7203eb9af5a43b1f6362b71d31b82bcc63ee6fe9cad52db87fa",
      "reference_media_duration_seconds": 2808.105215,
      "reference_last_caption_cue_end_seconds": 2794.64,
      "language": "en"
    },
    {
      "video_id": "linear_algebra_l04",
      "course_id": "mit_1806",
      "title": "Lecture 4: Factorization into A = LU",
      "source_url": "https://ocw.mit.edu/courses/18-06-linear-algebra-spring-2010/resources/lecture-4-factorization-into-a-lu/",
      "caption_url": "https://ocw.mit.edu/courses/18-06-linear-algebra-spring-2010/384c13ab0cd45489a5daad41294e844d_MsIvs_6vC38.vtt",
      "media_url": "http://www.archive.org/download/MIT18.06S05_MP4/04.mp4",
      "caption_sha256": "35a13f92e91bb530903fedb3b8679c091c503f7f1e6ce079996d8ec9c32242eb",
      "reference_media_duration_seconds": 2884.650667,
      "reference_last_caption_cue_end_seconds": 2877.48,
      "language": "en"
    },
    {
      "video_id": "linear_algebra_l05",
      "course_id": "mit_1806",
      "title": "Lecture 5: Transposes, Permutations, Spaces R^n",
      "source_url": "https://ocw.mit.edu/courses/18-06-linear-algebra-spring-2010/resources/lecture-5-transposes-permutations-spaces-r-n/",
      "caption_url": "https://ocw.mit.edu/courses/18-06-linear-algebra-spring-2010/eb5a7fe66ff6537aac15662f73d424b7_JibVXBElKL0.vtt",
      "media_url": "http://www.archive.org/download/MIT18.06S05_MP4/05.mp4",
      "caption_sha256": "c08f1885227b7376eec462a9914caf351f67f5ab0e1778b66db8869caa3da35b",
      "reference_media_duration_seconds": 2861.186032,
      "reference_last_caption_cue_end_seconds": 2852.27,
      "language": "en"
    },
    {
      "video_id": "python_l01",
      "course_id": "mit_60001",
      "title": "Lecture 1: What is Computation?",
      "source_url": "https://ocw.mit.edu/courses/6-0001-introduction-to-computer-science-and-programming-in-python-fall-2016/resources/lecture-1-what-is-computation/",
      "caption_url": "https://ocw.mit.edu/courses/6-0001-introduction-to-computer-science-and-programming-in-python-fall-2016/a746f6bc380f5e6d807ffff5f56cd877_nykOeWgQcHM.vtt",
      "media_url": "https://archive.org/download/MIT6.0001F16/MIT6_0001F16_Lecture_01_300k.mp4",
      "caption_sha256": "404eb34eff454f97932952f677ce4bec0457488616dc5548ed8be81f70210a9f",
      "reference_media_duration_seconds": 2585.964,
      "reference_last_caption_cue_end_seconds": 2577.16,
      "language": "en"
    },
    {
      "video_id": "python_l02",
      "course_id": "mit_60001",
      "title": "Lecture 2: Branching and Iteration",
      "source_url": "https://ocw.mit.edu/courses/6-0001-introduction-to-computer-science-and-programming-in-python-fall-2016/resources/lecture-2-branching-and-iteration/",
      "caption_url": "https://ocw.mit.edu/courses/6-0001-introduction-to-computer-science-and-programming-in-python-fall-2016/8a169eb715615fa0b797f83ff9d20ab8_0jljZRnHwOI.vtt",
      "media_url": "https://archive.org/download/MIT6.0001F16/MIT6_0001F16_Lecture_02_300k.mp4",
      "caption_sha256": "2cedaa556b3ab5c5f7ef9eff88c93fa5360815933591838bab9f9b9705dfedcd",
      "reference_media_duration_seconds": 2610.13,
      "reference_last_caption_cue_end_seconds": 2602.42,
      "language": "en"
    },
    {
      "video_id": "python_l03",
      "course_id": "mit_60001",
      "title": "Lecture 3: String Manipulation, Guess and Check, Approximations, Bisection",
      "source_url": "https://ocw.mit.edu/courses/6-0001-introduction-to-computer-science-and-programming-in-python-fall-2016/resources/lecture-3-string-manipulation-guess-and-check-approximations-bisection/",
      "caption_url": "https://ocw.mit.edu/courses/6-0001-introduction-to-computer-science-and-programming-in-python-fall-2016/6e2747d4f92152b8a5cf50493d1345d0_SE4P7IVCunE.vtt",
      "media_url": "https://archive.org/download/MIT6.0001F16/MIT6_0001F16_Lecture_03_300k.mp4",
      "caption_sha256": "8014f010b455014d13e241da401cfe8e5a48653878909006935674feba6706ea",
      "reference_media_duration_seconds": 2701.04,
      "reference_last_caption_cue_end_seconds": 2694.38,
      "language": "en"
    },
    {
      "video_id": "python_l04",
      "course_id": "mit_60001",
      "title": "Lecture 4: Decomposition, Abstraction, and Functions",
      "source_url": "https://ocw.mit.edu/courses/6-0001-introduction-to-computer-science-and-programming-in-python-fall-2016/resources/lecture-4-decomposition-abstraction-and-functions/",
      "caption_url": "https://ocw.mit.edu/courses/6-0001-introduction-to-computer-science-and-programming-in-python-fall-2016/89d4f8a478a957b49244641cb53d1cf8_MjbuarJ7SE0.vtt",
      "media_url": "https://archive.org/download/MIT6.0001F16/MIT6_0001F16_Lecture_04_300k.mp4",
      "caption_sha256": "28abb23043ebb5aaf7a69d0aeff05d24a7604a91cdb60dbf30ccbc679300e85d",
      "reference_media_duration_seconds": 2468.4,
      "reference_last_caption_cue_end_seconds": 2460.99,
      "language": "en"
    },
    {
      "video_id": "python_l05",
      "course_id": "mit_60001",
      "title": "Lecture 5: Tuples, Lists, Aliasing, Mutability, and Cloning",
      "source_url": "https://ocw.mit.edu/courses/6-0001-introduction-to-computer-science-and-programming-in-python-fall-2016/resources/lecture-5-tuples-lists-aliasing-mutability-and-cloning/",
      "caption_url": "https://ocw.mit.edu/courses/6-0001-introduction-to-computer-science-and-programming-in-python-fall-2016/87450a3bb883546da3cda15e422b259f_RvRKT-jXvko.vtt",
      "media_url": "https://archive.org/download/MIT6.0001F16/MIT6_0001F16_Lecture_05_300k.mp4",
      "caption_sha256": "4e1a54bc823045b83fefa0c7a76e8c7d8853dca765b02af445a80d1a99ce7c96",
      "reference_media_duration_seconds": 2487.15,
      "reference_last_caption_cue_end_seconds": 2479.49,
      "language": "en"
    }
  ]
}
